{"artifacts":[{"path":"captures/desktop_runtime.json","sha256":"a3ad3f73328b0768ee1549b9afdd64c4ac3ced8393787426cb18b4375696762f","size":370},{"path":"captures/graph_route_matrix.json","sha256":"9a1b2c5669dc9888f05be28599fdc88a9a959d6fdaf9900839cbe6acf3e5c177","size":3774},{"path":"captures/hosted_content_bytes.json","sha256":"47a8a8ee2a063858e6756c37ad4b6cd3a4f57f8e265db64d45446a131388560d","size":999},{"path":"captures/package_self_consistency.json","sha256":"c08941e379ca497c15beabaa35f9750cd6e97a84062d06bd52ccce6d02538eb8","size":1830}],"capture":{"binarySha256":"f52ccc22e6fe61ea5791f0e186db323155ad1cc1b6dfe547f4bc665bea57a2dd","capturedAt":"2026-09-16T12:31:50.596Z","desktopCell":"darwin-arm64","nodeVersion":"v24.21.0","osRelease":"26.6.2","suiteVersion":1,"toolSha256":"7c6785e764ccf6bd7b5ae1b517d26e98df413f3601f33916d8c97edd6b6681c1"},"probes":[{"expectedCodes":[],"id":"desktop_runtime","observedCodes":[],"output":"captures/desktop_runtime.json"},{"expectedCodes":["asset_stored","attachment_metadata_only","collected","identity_unresolved","render_downgraded","retained_history_not_requested"],"id":"graph_route_matrix","observedCodes":["asset_stored","attachment_metadata_only","collected","identity_unresolved","render_downgraded","retained_history_not_requested"],"output":"captures/graph_route_matrix.json"},{"expectedCodes":["asset_stored"],"id":"hosted_content_bytes","observedCodes":["asset_stored"],"output":"captures/hosted_content_bytes.json"},{"expectedCodes":[],"id":"package_self_consistency","observedCodes":[],"output":"captures/package_self_consistency.json"}],"schemaVersion":1,"tuple":{"desktopCell":"darwin-arm64","destination":{"system":"local_archive_package"},"guaranteeSetId":"default","jobType":"teams_archive","source":{"backend":{"apiVersion":"v1.0","cloud":"Global","options":{"attachmentBytes":false,"retainedHistory":false,"transcripts":false},"permissions":["Channel.ReadBasic.All","ChannelMessage.Read.All","Chat.Read.All"],"routes":["/v1.0/chats/{chatId}/messages/{messageId}/hostedContents","/v1.0/chats/{chatId}/messages/{messageId}/hostedContents/{hostedContentId}/$value","/v1.0/teams/{teamId}/channels","/v1.0/teams/{teamId}/channels/getAllMessages","/v1.0/teams/{teamId}/channels/{channelId}/messages/{messageId}/hostedContents","/v1.0/teams/{teamId}/channels/{channelId}/messages/{messageId}/hostedContents/{hostedContentId}/$value","/v1.0/teams/{teamId}/channels/{channelId}/messages/{messageId}/replies/{replyId}/hostedContents","/v1.0/teams/{teamId}/channels/{channelId}/messages/{messageId}/replies/{replyId}/hostedContents/{hostedContentId}/$value","/v1.0/users/{userId}/chats","/v1.0/users/{userId}/chats/getAllMessages"]},"system":"microsoft_teams"},"transferVersion":"v1.75.0"}}
