{"artifacts":[{"path":"captures/archive_destination.json","sha256":"67464d2d2372c9febb2636d5a94d6b75980bef9aeb2454f9c3e743669ed7ade3","size":9120},{"path":"captures/desktop_runtime.json","sha256":"773be46b2f22433c192fccb5e51fd24cd3591d334f93965fd733861fb6b8ce47","size":370},{"path":"captures/graph_route_matrix.json","sha256":"fc744173044b2a5edb6155565791275cd58a8094c9c2b25c5c068f4e0e8ebc42","size":5028},{"path":"captures/hosted_content_bytes.json","sha256":"21a89a08da791390b8ec2287b87dc3242c8346af9119ea9f34ed1d062ce5979d","size":999},{"path":"captures/package_self_consistency.json","sha256":"14ffb6d211cbf8c37602cc08d9268d026a13b98ba8abe381eb4a1f98315fa815","size":2798},{"path":"captures/retained_history.json","sha256":"487fc0f74ebf67ae4e3ddebb798298eb72d0fe3242d2ee10542ce5c6ae1ca627","size":1371}],"capture":{"binarySha256":"f52ccc22e6fe61ea5791f0e186db323155ad1cc1b6dfe547f4bc665bea57a2dd","capturedAt":"2026-09-20T20:07:28.455Z","desktopCell":"darwin-arm64","nodeVersion":"v24.21.0","osRelease":"26.6.2","suiteVersion":1,"toolSha256":"901009fee6cdc2a2ac3b5ae07f59e36ffe9f5da3c69f3615215e8028578d6ac5"},"probes":[{"expectedCodes":["content_mismatch","metadata_mismatch","prior_copy_drift","size_mismatch","unowned_path_collision"],"id":"archive_destination","observedCodes":["content_mismatch","metadata_mismatch","prior_copy_drift","size_mismatch","unowned_path_collision"],"output":"captures/archive_destination.json"},{"expectedCodes":[],"id":"desktop_runtime","observedCodes":[],"output":"captures/desktop_runtime.json"},{"expectedCodes":["asset_stored","attachment_metadata_only","collected","identity_unresolved","render_downgraded"],"id":"graph_route_matrix","observedCodes":["asset_stored","attachment_metadata_only","collected","identity_unresolved","render_downgraded"],"output":"captures/graph_route_matrix.json"},{"expectedCodes":["asset_stored"],"id":"hosted_content_bytes","observedCodes":["asset_stored"],"output":"captures/hosted_content_bytes.json"},{"expectedCodes":[],"id":"package_self_consistency","observedCodes":[],"output":"captures/package_self_consistency.json"},{"expectedCodes":[],"id":"retained_history","observedCodes":[],"output":"captures/retained_history.json"}],"schemaVersion":1,"tuple":{"desktopCell":"darwin-arm64","destination":{"backend":{"authentication":"service_account","type":"drive"},"system":"google_shared_drive"},"guaranteeSetId":"default","jobType":"teams_archive","source":{"backend":{"apiVersion":"v1.0","cloud":"Global","options":{"attachmentBytes":false,"retainedHistory":true,"transcripts":false},"permissions":["Channel.ReadBasic.All","ChannelMessage.Read.All","Chat.Read.All"],"routes":["/v1.0/chats/{chatId}/messages/{messageId}/hostedContents","/v1.0/chats/{chatId}/messages/{messageId}/hostedContents/{hostedContentId}/$value","/v1.0/teams/{teamId}/channels","/v1.0/teams/{teamId}/channels/getAllMessages","/v1.0/teams/{teamId}/channels/getAllRetainedMessages","/v1.0/teams/{teamId}/channels/{channelId}/messages/{messageId}/hostedContents","/v1.0/teams/{teamId}/channels/{channelId}/messages/{messageId}/hostedContents/{hostedContentId}/$value","/v1.0/teams/{teamId}/channels/{channelId}/messages/{messageId}/replies/{replyId}/hostedContents","/v1.0/teams/{teamId}/channels/{channelId}/messages/{messageId}/replies/{replyId}/hostedContents/{hostedContentId}/$value","/v1.0/users/{userId}/chats","/v1.0/users/{userId}/chats/getAllMessages","/v1.0/users/{userId}/chats/getAllRetainedMessages"]},"system":"microsoft_teams"},"transferVersion":"v1.75.0"}}
