{"artifacts":[{"path":"captures/archive_destination.json","sha256":"a67d20dd1d678d9a86eadd12c7d6e865786e7bc59e73e2cb00682443a6cfa6ba","size":2567},{"path":"captures/desktop_runtime.json","sha256":"89da31cf19a6104567cadee2cc1a537d2acc5089ed4a3fd8576b082118ba9792","size":370},{"path":"captures/graph_route_matrix.json","sha256":"782aeb2955832304bbfca10c1ff4897dd59cd9ee3f9f3996a2c7abeff202553f","size":3774},{"path":"captures/hosted_content_bytes.json","sha256":"035f7f8c50a565d8a51817fafed895a572cfe308a1d5f475a36132bdd5686b66","size":999},{"path":"captures/package_self_consistency.json","sha256":"866132cb7fbb3c28f556c384876d9ffb4897eac0a1c4e49738d2fcbebf3d7331","size":1830}],"capture":{"binarySha256":"f52ccc22e6fe61ea5791f0e186db323155ad1cc1b6dfe547f4bc665bea57a2dd","capturedAt":"2026-09-16T22:38:58.087Z","desktopCell":"darwin-arm64","nodeVersion":"v24.21.0","osRelease":"26.6.2","suiteVersion":1,"toolSha256":"ca8ef1924cd922c0ee08d1ff8d0cc79e33744a8fdc98d4f39d9bb565402207d6"},"probes":[{"expectedCodes":[],"id":"archive_destination","observedCodes":[],"output":"captures/archive_destination.json"},{"expectedCodes":[],"id":"desktop_runtime","observedCodes":[],"output":"captures/desktop_runtime.json"},{"expectedCodes":["asset_stored","attachment_metadata_only","collected","identity_unresolved","render_downgraded","retained_history_not_requested"],"id":"graph_route_matrix","observedCodes":["asset_stored","attachment_metadata_only","collected","identity_unresolved","render_downgraded","retained_history_not_requested"],"output":"captures/graph_route_matrix.json"},{"expectedCodes":["asset_stored"],"id":"hosted_content_bytes","observedCodes":["asset_stored"],"output":"captures/hosted_content_bytes.json"},{"expectedCodes":[],"id":"package_self_consistency","observedCodes":[],"output":"captures/package_self_consistency.json"}],"schemaVersion":1,"tuple":{"desktopCell":"darwin-arm64","destination":{"backend":{"authentication":"service_account","type":"drive"},"system":"google_shared_drive"},"guaranteeSetId":"default","jobType":"teams_archive","source":{"backend":{"apiVersion":"v1.0","cloud":"Global","options":{"attachmentBytes":false,"retainedHistory":false,"transcripts":false},"permissions":["Channel.ReadBasic.All","ChannelMessage.Read.All","Chat.Read.All"],"routes":["/v1.0/chats/{chatId}/messages/{messageId}/hostedContents","/v1.0/chats/{chatId}/messages/{messageId}/hostedContents/{hostedContentId}/$value","/v1.0/teams/{teamId}/channels","/v1.0/teams/{teamId}/channels/getAllMessages","/v1.0/teams/{teamId}/channels/{channelId}/messages/{messageId}/hostedContents","/v1.0/teams/{teamId}/channels/{channelId}/messages/{messageId}/hostedContents/{hostedContentId}/$value","/v1.0/teams/{teamId}/channels/{channelId}/messages/{messageId}/replies/{replyId}/hostedContents","/v1.0/teams/{teamId}/channels/{channelId}/messages/{messageId}/replies/{replyId}/hostedContents/{hostedContentId}/$value","/v1.0/users/{userId}/chats","/v1.0/users/{userId}/chats/getAllMessages"]},"system":"microsoft_teams"},"transferVersion":"v1.75.0"}}
