{"artifacts":[{"path":"captures/desktop_runtime.json","sha256":"a5e11e7a8ceb98b1465455f4bb920799c254b5288ff4cd88a1cf9cee0f91d3be","size":370},{"path":"captures/graph_route_matrix.json","sha256":"327c5465f8b075e0fa9ce0ebb917a25410b217aa2c791a913c4aacad8e9c31db","size":5028},{"path":"captures/hosted_content_bytes.json","sha256":"ada86afb72bde2d24ba6ac4a34579a731803508f93333de14ebcab419ebb4b44","size":999},{"path":"captures/package_self_consistency.json","sha256":"c40b69eb68092d91d247d2f60f1a15f168351c8527c195b56ff601d9a0648145","size":2798},{"path":"captures/retained_history.json","sha256":"5144e946984af11956893beb2e188f28152e2d5683d87eed56f600e34663430a","size":1371}],"capture":{"binarySha256":"f52ccc22e6fe61ea5791f0e186db323155ad1cc1b6dfe547f4bc665bea57a2dd","capturedAt":"2026-09-17T19:44:10.260Z","desktopCell":"darwin-arm64","nodeVersion":"v24.21.0","osRelease":"26.6.2","suiteVersion":1,"toolSha256":"1953d05a451db7f790a1e2e026601aa8fe90f056e83794a3042e08564e68547e"},"probes":[{"expectedCodes":[],"id":"desktop_runtime","observedCodes":[],"output":"captures/desktop_runtime.json"},{"expectedCodes":["asset_stored","attachment_metadata_only","collected","identity_unresolved","render_downgraded"],"id":"graph_route_matrix","observedCodes":["asset_stored","attachment_metadata_only","collected","identity_unresolved","render_downgraded"],"output":"captures/graph_route_matrix.json"},{"expectedCodes":["asset_stored"],"id":"hosted_content_bytes","observedCodes":["asset_stored"],"output":"captures/hosted_content_bytes.json"},{"expectedCodes":[],"id":"package_self_consistency","observedCodes":[],"output":"captures/package_self_consistency.json"},{"expectedCodes":[],"id":"retained_history","observedCodes":[],"output":"captures/retained_history.json"}],"schemaVersion":1,"tuple":{"desktopCell":"darwin-arm64","destination":{"system":"local_archive_package"},"guaranteeSetId":"default","jobType":"teams_archive","source":{"backend":{"apiVersion":"v1.0","cloud":"Global","options":{"attachmentBytes":false,"retainedHistory":true,"transcripts":false},"permissions":["Channel.ReadBasic.All","ChannelMessage.Read.All","Chat.Read.All"],"routes":["/v1.0/chats/{chatId}/messages/{messageId}/hostedContents","/v1.0/chats/{chatId}/messages/{messageId}/hostedContents/{hostedContentId}/$value","/v1.0/teams/{teamId}/channels","/v1.0/teams/{teamId}/channels/getAllMessages","/v1.0/teams/{teamId}/channels/getAllRetainedMessages","/v1.0/teams/{teamId}/channels/{channelId}/messages/{messageId}/hostedContents","/v1.0/teams/{teamId}/channels/{channelId}/messages/{messageId}/hostedContents/{hostedContentId}/$value","/v1.0/teams/{teamId}/channels/{channelId}/messages/{messageId}/replies/{replyId}/hostedContents","/v1.0/teams/{teamId}/channels/{channelId}/messages/{messageId}/replies/{replyId}/hostedContents/{hostedContentId}/$value","/v1.0/users/{userId}/chats","/v1.0/users/{userId}/chats/getAllMessages","/v1.0/users/{userId}/chats/getAllRetainedMessages"]},"system":"microsoft_teams"},"transferVersion":"v1.75.0"}}
