{"artifacts":[{"path":"captures/checksum_fresh_upload.json","sha256":"1b627fc0d0144c6fc1adeed9ebc56c68d1927ac7b053ddad93e8ef8116b5efff","size":1586},{"path":"captures/collision_matrix.json","sha256":"5e4128698b1c1534b95805bb007e5eb3c06a23d1e5a5ef53c77671a44b1b47a4","size":4066},{"path":"captures/desktop_runtime.json","sha256":"d6a5f7e2006f1b94bae86b626cdd54282b03b4815147fc5773d97a07041100cb","size":370},{"path":"captures/metadata_round_trip.json","sha256":"21b315e23250ba464dff96d622f0078a7aa1944210ecd6cac2065ac7793490d3","size":984},{"path":"captures/provenance_marker_round_trip.json","sha256":"0dbbb16333901668a1b096830df42cd353e323b2ae78a3bc91c104518e392c06","size":1131},{"path":"captures/route_limits_and_version_gate.json","sha256":"8d2a05921cef5520c5c2ea327944d96ff453d1cb8a5b99e5ed5c568a7e01c55c","size":3466},{"path":"captures/stable_id_additive_rerun_and_move.json","sha256":"0d474030cf13151b4da6612e3df4b45f1c22ce5565cd2685296c6fb369a276dd","size":3349},{"path":"captures/zero_byte_and_empty_folder_copy.json","sha256":"502621e18ff24cbd9c8a34ceb21641b25950ea51ece10986866ef7495eb5362a","size":1292}],"capture":{"binarySha256":"f52ccc22e6fe61ea5791f0e186db323155ad1cc1b6dfe547f4bc665bea57a2dd","capturedAt":"2026-09-16T12:58:59.440Z","desktopCell":"darwin-arm64","nodeVersion":"v24.21.0","osRelease":"26.6.2","suiteVersion":1,"toolSha256":"1b892788ced6753eafe82c7c40d4595671d28561ce9f3f33ff3dce46a2a774c7"},"probes":[{"expectedCodes":["source_metadata_export_only","unchanged"],"id":"checksum_fresh_upload","observedCodes":["source_metadata_export_only","unchanged"],"output":"captures/checksum_fresh_upload.json"},{"expectedCodes":["created","destination_duplicate_name","destination_only_retained","destination_type_conflict","mapping_overlap","path_unrepresentable","prior_copy_drift","source_deleted_destination_retained","source_identity_reuse_collision","source_metadata_export_only","unchanged","unowned_path_collision"],"id":"collision_matrix","observedCodes":["created","destination_duplicate_name","destination_only_retained","destination_type_conflict","mapping_overlap","path_unrepresentable","prior_copy_drift","source_deleted_destination_retained","source_identity_reuse_collision","source_metadata_export_only","unchanged","unowned_path_collision"],"output":"captures/collision_matrix.json"},{"expectedCodes":[],"id":"desktop_runtime","observedCodes":[],"output":"captures/desktop_runtime.json"},{"expectedCodes":["created","source_metadata_export_only","unchanged"],"id":"metadata_round_trip","observedCodes":["created","source_metadata_export_only","unchanged"],"output":"captures/metadata_round_trip.json"},{"expectedCodes":["created","source_metadata_export_only","unchanged"],"id":"provenance_marker_round_trip","observedCodes":["created","source_metadata_export_only","unchanged"],"output":"captures/provenance_marker_round_trip.json"},{"expectedCodes":["omitted_by_rule","preflight_failed","source_package_omitted","unchanged"],"id":"route_limits_and_version_gate","observedCodes":["omitted_by_rule","preflight_failed","source_package_omitted","unchanged"],"output":"captures/route_limits_and_version_gate.json"},{"expectedCodes":["created","destination_only_retained","moved","source_deleted_destination_retained","source_metadata_export_only","unchanged","updated","version_history_omitted"],"id":"stable_id_additive_rerun_and_move","observedCodes":["created","destination_only_retained","moved","source_deleted_destination_retained","source_metadata_export_only","unchanged","updated","version_history_omitted"],"output":"captures/stable_id_additive_rerun_and_move.json"},{"expectedCodes":["created","source_metadata_export_only","unchanged"],"id":"zero_byte_and_empty_folder_copy","observedCodes":["created","source_metadata_export_only","unchanged"],"output":"captures/zero_byte_and_empty_folder_copy.json"}],"schemaVersion":1,"tuple":{"desktopCell":"darwin-arm64","destination":{"backend":{"authentication":"service_account","importFormats":[],"metadata":["btime","mtime","content-type"],"skipGdocs":true,"skipShortcuts":true,"type":"drive"},"system":"google_shared_drive"},"guaranteeSetId":"default","jobType":"file_migration","source":{"backend":{"authentication":"client_credentials","driveType":"documentLibrary","encoding":"Slash","type":"onedrive"},"system":"sharepoint_document_library"},"transferVersion":"v1.75.0"}}
